{"activation":{"facts":[{"condition":{"equals":true,"path":"serviceMonitor.create"},"context":".","observed":{"context":".","fact_digest":"867895dcf0a73594ba05c9f73d6cf19fe1aca44b1d6a2fd365037cba0c8e5bdb","origin":"DIRECT_INPUT","origin_evidence":{"protected_input_identity":"e414fbb8a6a62e85d1dd0bbbb32613cbe7bef740d7fb9e06422c2380423c48c6"},"path":"serviceMonitor.create","present":true,"value":true},"origin_matches":true,"path":"serviceMonitor.create","state":true}],"input_identity":"9f58661a12ae6ceb4705d6310686b23105e04da0ea1e520fdb727944cb143b89","reason_code":"ACTIVATION_CONDITION_TRUE","status":"ACTIVE"},"clauses":[{"clause_id":"monitor-resolves-service","clause_identity":"45e6e37d3b12cb2acd9082756f4c3546978244fc9f50dc9923ede4119c7f4126","native_observations":[{"definition":{"artifact_class":"kubernetes_rendered","capabilities":{"can_satisfy":true,"can_violate":true,"relationship_graph":true,"requires_complete_universe_for_violation":true,"source_span":false},"implementation":{"implementation_digest":"85b9c8ea508d50fcaa90f4e30dbc78a2f6b27932afe77e36abc623a45ae2bb51","implementation_version":"a9-v1","modules":[{"module":"fingerprints","sha256":"971d2e8e1ae3b9cbbf712f139de2e0c6bd2a6e2f42fed3c4c4fea98a7fc967b1"},{"module":"models","sha256":"c4710984833714c018c6de8864b6f3e00865c7bc1301874b565de84a0eb022d4"},{"module":"native_properties.contracts.prometheus-operator-v1","sha256":"68740bcc9738865f967a5a37bf74a53db18515a147840016be066dd207c14e4b"},{"module":"native_properties.engine","sha256":"347b678d26e4d480a330e6aaf544c7c894eaf12fe56841ab1078c9a6a4c584e2"},{"module":"native_properties.evidence","sha256":"643a8a33e9d3345d997cc329a50288386147d328c5c8caf2ce9ef28050383f70"},{"module":"native_properties.model","sha256":"af56a13f94cee0e7d1e22690e9487cf502aaa006f01a720ca5849a62f7e18732"},{"module":"native_properties.network_policy","sha256":"0188ceb2426d9fa513f7618d88d83c29db3abd6d02fa613bff344a66b830b81f"},{"module":"native_properties.outcome","sha256":"fd6355507f8e826c33d4e6f81d21c779693e0ad867b546d3ba28477b0f913e2d"},{"module":"native_properties.prometheus_operator","sha256":"055bd35302cee61f3f4b3f42154661363fb38fe3bd0536297620aa9f58fa6f1a"},{"module":"native_properties.registry","sha256":"3915310f26f15be5f40e821e848db47cc29b80f4ee9ef48a0940873dfe9fe870"},{"module":"native_properties.selectors","sha256":"ea696257f5c71be1576ab810e60611916dff5edd46b87260022758b661c8b754"},{"module":"native_properties.services","sha256":"5098f61b010ca074871d94ef5a2b75f64e17333b28449c0b3b95516499b29890"},{"module":"native_properties.universe","sha256":"f64fa2393e5702a68658b40714ecfe086c89d79372cadd3be0118619a8451015"}]},"parameter_schema":{"additionalProperties":false,"properties":{"endpoint_index":{"minimum":0,"type":"integer"},"expected_service":{"minLength":1,"type":"string"}},"required":[],"type":"object"},"parameter_schema_digest":"4d9f135dcc5b4f0aaaa7c47cdbbb48108009186675deb530bccb9b8396103e12","property_id":"IACGV_PROM_SERVICEMONITOR_RESOLVES_SERVICE_PORT_V1","property_namespace":"iac_guard_v","property_version":"1","semantic_binding":{"contract_digest":"bf6d98d0b1fb34073ef15b3a7081e51f928067ed25d09758c1233c52c48b4869","system":"kubernetes","version":"v1.34.0"},"semantic_definition_digest":"1d548554946507b9a6f5ec5fbda1f39af2fdc5416214ad6e0db8f6233e88d2d5","subject_class":"service_monitor","witness_type":"prometheus_monitor_resolution_v1"},"observation_digest":"df98e4b2affb1ea4dca330a16f98b18ea46db8a4c2ecfa77dd2ea5f4abf1c51d","reason_code":"SERVICEMONITOR_TARGET_RESOLVED","request":{"artifact_class":"kubernetes_rendered","parameters":{"endpoint_index":0},"parameters_digest":"3b6c0d01a515b9d73df4488d5ccc38d351b5f605566d726ae17e340bbb84d37c","property_id":"IACGV_PROM_SERVICEMONITOR_RESOLVES_SERVICE_PORT_V1","property_version":"1","protected_universe_identity":"7066e0a8a245d79f7d65b3126b1ecefae1d4427e75d41fd53ae49f420e4c6a4f","request_id":"monitor-resolves-service-0001","subject_identity":"monitoring.coreos.com/v1/ServiceMonitor/a10-impact/a10-impact-falco"},"result":"SATISFIED","subject_provenance":{"document_index":7,"file_path":"objects.yaml","identity":"monitoring.coreos.com/v1/ServiceMonitor/a10-impact/a10-impact-falco","list_index":null,"source_sha256":"bc7068d5817cabf16a724ecf8c5e62fbbe2cc8c5ae64e91adf190f3729cc5fa2"},"witness":{"contents":{"contract_digest":"68740bcc9738865f967a5a37bf74a53db18515a147840016be066dd207c14e4b","endpoint":{"port":"metrics","protocol":"TCP"},"endpoint_index":0,"expected_service":null,"matched_services":["v1/Service/a10-impact/a10-impact-falco-metrics"],"monitor":{"document_index":7,"file_path":"objects.yaml","identity":"monitoring.coreos.com/v1/ServiceMonitor/a10-impact/a10-impact-falco","list_index":null,"source_sha256":"bc7068d5817cabf16a724ecf8c5e62fbbe2cc8c5ae64e91adf190f3729cc5fa2"},"namespace_selection":["a10-impact"],"service_candidates":[{"labels":{"app.kubernetes.io/instance":"a10-impact","app.kubernetes.io/managed-by":"Helm","app.kubernetes.io/name":"falco","app.kubernetes.io/version":"0.44.1","helm.sh/chart":"falco-9.1.0","type":"falco-metrics"},"selector_evaluation":{"expressions":[{"key":"app.kubernetes.io/instance","matched":true,"observed_present":true,"observed_value":"a10-impact","operator":"Equals","values":["a10-impact"]},{"key":"app.kubernetes.io/name","matched":true,"observed_present":true,"observed_value":"falco","operator":"Equals","values":["falco"]},{"key":"type","matched":true,"observed_present":true,"observed_value":"falco-metrics","operator":"Equals","values":["falco-metrics"]}],"matched":true,"selector":{"matchExpressions":[],"matchLabels":{"app.kubernetes.io/instance":"a10-impact","app.kubernetes.io/name":"falco","type":"falco-metrics"}},"target_labels":{"app.kubernetes.io/instance":"a10-impact","app.kubernetes.io/managed-by":"Helm","app.kubernetes.io/name":"falco","app.kubernetes.io/version":"0.44.1","helm.sh/chart":"falco-9.1.0","type":"falco-metrics"}},"service":{"document_index":5,"file_path":"objects.yaml","identity":"v1/Service/a10-impact/a10-impact-falco-metrics","list_index":null,"source_sha256":"bc7068d5817cabf16a724ecf8c5e62fbbe2cc8c5ae64e91adf190f3729cc5fa2"}}],"service_port_resolutions":[{"candidate_workloads":[{"identity":"apps/v1/DaemonSet/a10-impact/a10-impact-falco","pod_labels":{"app.kubernetes.io/instance":"a10-impact","app.kubernetes.io/name":"falco"},"selector_evaluation":{"expressions":[{"key":"app.kubernetes.io/instance","matched":true,"observed_present":true,"observed_value":"a10-impact","operator":"Equals","values":["a10-impact"]},{"key":"app.kubernetes.io/name","matched":true,"observed_present":true,"observed_value":"falco","operator":"Equals","values":["falco"]}],"matched":true,"selector":{"matchExpressions":[],"matchLabels":{"app.kubernetes.io/instance":"a10-impact","app.kubernetes.io/name":"falco"}},"target_labels":{"app.kubernetes.io/instance":"a10-impact","app.kubernetes.io/name":"falco"}}}],"matched_workloads":["apps/v1/DaemonSet/a10-impact/a10-impact-falco"],"resolutions":[{"container_occurrence":"apps/v1/DaemonSet/a10-impact/a10-impact-falco#containers[0]/falco","container_port":8765,"declared_container_occurrences":["apps/v1/DaemonSet/a10-impact/a10-impact-falco#containers[0]/falco"],"protocol":"TCP","resolution":"NUMERIC","workload":"apps/v1/DaemonSet/a10-impact/a10-impact-falco"}],"resolved_port_set":[8765],"service":{"document_index":5,"file_path":"objects.yaml","identity":"v1/Service/a10-impact/a10-impact-falco-metrics","list_index":null,"source_sha256":"bc7068d5817cabf16a724ecf8c5e62fbbe2cc8c5ae64e91adf190f3729cc5fa2"},"service_namespace":"a10-impact","service_port":{"name":"metrics","port":8765,"protocol":"TCP","selector":{"name":"metrics","protocol":"TCP"},"targetPort":8765,"targetPort_defaulted":false},"service_selector":{"app.kubernetes.io/instance":"a10-impact","app.kubernetes.io/name":"falco"},"unresolved_workloads":[]}]},"witness_digest":"f92fdc3c5e980bc43edc716a56df2eef6c5252b7cadfdd2c3fc5ddac397c8851","witness_type":"prometheus_monitor_resolution_v1"}}],"observation_digest":"f72aa4a60429e9c4b1fa554aadb4c94b70a4629308d63dc55f2ed2f79a13861d","reason_code":"NATIVE_PROPERTIES_SATISFIED","required":true,"result":"SATISFIED","target_count":1}],"compiler_identity":"7990eeae19c6e93b7a6cee68ef3c2c582c2f85ef86d88029c50bfa48905daff7","contract":{"canonical_digest":"44932e63c8294c9c1c3dbeabeec464f5f8a05079bb1ff107291f9c174e8214ca","canonical_payload":{"apiVersion":"iac-guard-v.io/v1alpha1","kind":"InfrastructureContract","metadata":{"name":"falco-monitoring-relationship-research"},"spec":{"artifactClass":"kubernetes_rendered","expect":[{"id":"monitor-resolves-service","parameters":{"endpoint_index":0},"property":{"id":"IACGV_PROM_SERVICEMONITOR_RESOLVES_SERVICE_PORT_V1","namespace":"iac_guard_v","version":"1"},"relationCardinality":{"targetMin":1}}],"responsibility":{"class":"PROJECT_MANAGED","reason":"Research hypothesis for the chart's built-in Falco monitoring relationship."},"subjects":{"cardinality":{"max":1,"min":1},"include":{"identities":["monitoring.coreos.com/v1/ServiceMonitor/a10-impact/a10-impact-falco"]}},"when":{"value":{"equals":true,"path":"serviceMonitor.create"}}}},"identity":"33cde5efbf129b8d97fec1aede59bc662fa3a7091b70dccad7f4834c9544611f","name":"falco-monitoring-relationship-research","responsibility":{"class":"PROJECT_MANAGED","reason":"Research hypothesis for the chart's built-in Falco monitoring relationship."},"schema_identity":"c6baff537d854c2cea8204a5fc740d88bee79e9abb91b2aa5389dafbee4a65cc","source":{"path":"external/CONTRACT.yaml","project_root_identity":"540e8f1c887e4ec777cbea1b1378eda9b657f50bb745fb632fff106898aefc72","provenance":"RESEARCH_HYPOTHESIS","raw_sha256":"9540f03212791b49bd1aea5c52a657beac6290c2210a2a04917b9ccca8759da0","source_commit":"53586de4fb9d8d02006131ade702b161cd7e06e3"}},"exit_code":0,"native_registry_identity":"de9a293ea2d3da8dbdbbbe3b12aa5b5d212ba789af225ea714b18d91dc501f90","plan":{"activation":{"facts":[{"condition":{"equals":true,"path":"serviceMonitor.create"},"context":".